### ISSUE TITLE
Bug: CORS issue?

### ISSUE THREAD

**Issue by mkrsn** [grocy/grocy#1996]
Environment:
- apache 2.4.54
- php 8.1.8

Today I've freshly installed (or better I'm trying) grocy in a own vhost. I've configured php-fpm and opened the instance in chromium. I always getting HTTP500 - no matter what i'm trying. I've enabled all logging, enabled php debug log but all seems to be fine. The HTTP500 seems to come from grocy itself. tcpdump (Socket from php-fpm) shows the following

```
20:18:22.647518 lo    In  IP 127.0.0.1.41108 > 127.0.0.1.9004: Flags [S], seq 2699401185, win 65495, options [mss 65495,sackOK,TS val 622771120 ecr 0,nop,wscale 7], length 0
E..<0.@.@.............#,.............0.........
%...........
20:18:22.647541 lo    In  IP 127.0.0.1.9004 > 127.0.0.1.41108: Flags [S.], seq 1173462563, ack 2699401186, win 65483, options [mss 65495,sackOK,TS val 622771120 ecr 622771120,nop,wscale 7], length 0
E..<..@.@.<.........#,..E..#.........0.........
%...%.......
20:18:22.647563 lo    In  IP 127.0.0.1.41108 > 127.0.0.1.9004: Flags [.], ack 1, win 512, options [nop,nop,TS val 622771120 ecr 622771120], length 0
E..40.@.@.............#,....E..$.....(.....
%...%...
20:18:22.647615 lo    In  IP 127.0.0.1.41108 > 127.0.0.1.9004: Flags [P.], seq 1:17, ack 1, win 512, options [nop,nop,TS val 622771120 ecr 622771120], length 16
E..D0.@.@.............#,....E..$.....8.....
%...%...................
20:18:22.647625 lo    In  IP 127.0.0.1.9004 > 127.0.0.1.41108: Flags [.], ack 17, win 512, options [nop,nop,TS val 622771120 ecr 622771120], length 0
E..4..@.@.Z+........#,..E..$.........(.....
%...%...
20:18:22.647750 lo    In  IP 127.0.0.1.41108 > 127.0.0.1.9004: Flags [P.], seq 17:1574, ack 1, win 512, options [nop,nop,TS val 622771120 ecr 622771120], length 1557
E..I0.@.@.............#,....E..$.....>.....
%...%.............HTTP_AUTHORIZATION..HTTPSon..SSL_TLS_SNIgrocy.home.domain.de  .HTTP_HOSTgrocy.home.domain.de.
HTTP_CONNECTIONkeep-alive.  HTTP_CACHE_CONTROLmax-age=0.)HTTP_SEC_CH_UA" Not A;Brand";v="99", "Chromium";v="104"..HTTP_SEC_CH_UA_MOBILE?0..HTTP_SEC_CH_UA_PLATFORM"Linux"..HTTP_UPGRADE_INSECURE_REQUESTS1.jHTTP_USER_AGENTMozilla/5.0 (X11; Linux x86_64) AppleWebKit/537.36 (KHTML, like Gecko) Chrome/104.0.5112.101 Safari/537.36.....HTTP_ACCEPTtext/html,application/xhtml+xml,application/xml;q=0.9,image/avif,image/webp,image/apng,*/*;q=0.8,application/signed-exchange;v=b3;q=0.9.
HTTP_SEC_FETCH_SITEcross-site..HTTP_SEC_FETCH_MODEnavigate..HTTP_SEC_FETCH_USER?1..HTTP_SEC_FETCH_DESTdocument..HTTP_ACCEPT_ENCODINGgzip, deflate, br..HTTP_ACCEPT_LANGUAGEde,en-US;q=0.9,en;q=0.8.cPATH/bin:/sbin:/bin:/sbin:/usr/bin:/usr/sbin:/usr/bin:/usr/sbin:/usr/local/bin:/usr/local/sbin:/opt/bin.GSERVER_SIGNATURE<address>Apache Server at grocy.home.domain.de Port 443</address>
..SERVER_SOFTWAREApache..SERVER_NAMEgrocy.home.domain.de.
SERVER_ADDR10.0.2.103..SERVER_PORT443..REMOTE_ADDR10.0.2.2.3DOCUMENT_ROOT/var/www/grocy.home.domain.de/www/html/public/..REQUEST_SCHEMEhttps..CONTEXT_PREFIX.3CONTEXT_DOCUMENT_ROOT/var/www/grocy.home.domain.de/www/html/public/..SERVER_ADMINwebmaster@domain.de.WSCRIPT_FILENAMEproxy:fcgi://127.0.0.1:9004/var/www/grocy.home.domain.de/www/html/public/index.php..REMOTE_PORT37508..GATEWAY_INTERFACECGI/1.1..SERVER_PROTOCOLHTTP/1.1..REQUEST_METHODGET..QUERY_STRING..REQUEST_URI/.
SCRIPT_NAME/index.php
20:18:22.647761 lo    In  IP 127.0.0.1.9004 > 127.0.0.1.41108: Flags [.], ack 1574, win 501, options [nop,nop,TS val 622771120 ecr 622771120], length 0
E..4..@.@.Z*........#,..E..$.........(.....
%...%...
20:18:22.647834 lo    In  IP 127.0.0.1.41108 > 127.0.0.1.9004: Flags [P.], seq 1574:1582, ack 1, win 512, options [nop,nop,TS val 622771120 ecr 622771120], length 8
E..<0.@.@.............#,....E..$.....0.....
%...%...........
20:18:22.647863 lo    In  IP 127.0.0.1.9004 > 127.0.0.1.41108: Flags [.], ack 1582, win 501, options [nop,nop,TS val 622771121 ecr 622771120], length 0
E..4..@.@.Z)........#,..E..$.........(.....
%...%...
20:18:22.647883 lo    In  IP 127.0.0.1.41108 > 127.0.0.1.9004: Flags [P.], seq 1582:1590, ack 1, win 512, options [nop,nop,TS val 622771121 ecr 622771121], length 8
E..<0.@.@.............#,....E..$.....0.....
%...%...........
20:18:22.647889 lo    In  IP 127.0.0.1.9004 > 127.0.0.1.41108: Flags [.], ack 1590, win 507, options [nop,nop,TS val 622771121 ecr 622771121], length 0
E..4..@.@.Z(........#,..E..$.........(.....
%...%...
20:18:22.685620 lo    In  IP 127.0.0.1.9004 > 127.0.0.1.41108: Flags [P.], seq 1:233, ack 1590, win 507, options [nop,nop,TS val 622771158 ecr 622771121], length 232
E.....@.@.Y?........#,..E..$...............
%...%...........Status: 500 Internal Server Error
Access-Control-Allow-Origin: *
Access-Control-Allow-Methods: GET, POST, PUT, DELETE, OPTIONS
Access-Control-Allow-Headers: *
```

As you can see there is only a standard fcgi proxy Request. It transports a GET-Request to PHP via Socket. The Applications answers with a HTTP500 (no error logs at all). I've traced the ACL Cors stuff back to CorsMiddleware.php.

I even tried with strace to check what the php process is doing, i can't find any problems here that would explain that http500.

But after here I'm a bit lost because of missing knowledge about grocy internals. Any further Ideas?

Greetings
Matthias

**Comment by berrnd** [comment]
The is the tracker for reproducible bugs and feature requests, not the place for general help/support requests ([README ref](https://github.com/grocy/grocy#questions--help--bug-reports--feature-requests)).

For just like any internal server error, you most likely find more in your webserver and/or PHP logs, so I would start looking there. Never thought of looking at a TCP dump to debug web requests so far, at least I can see nothing in the provided dump above.

CORS options preflight / OPTIONS requests are handled and it works, can also be easily verified by trying things on an demo instance.

> The HTTP500 seems to come from grocy itself.

At no place a 500 response code is triggered on purpose, since this makes no sense. An internal server error is always an unhandled exception.

This can happen when e.g. not making the `data` directory writable (just [one of the things mentioned in README](https://github.com/grocy/grocy#how-to-install)).

**Comment by berrnd** [comment]
> php 8.1.8

Also this will cause problem, please have another look at [README](https://github.com/grocy/grocy#how-to-install):

_Currently everything is only tested against (means 100 % works with) PHP 8.0 with SQLite 3.27.2_
